{
  "$schema": "https://json-schema.org/draft/2020-12/schema",
  "$id": "https://orchids.kaukea/message.schema.json",
  "title": "Courier message envelope",
  "description": "The on-disk format of one courier message. Owned by tools/courier.py; this schema is the canonical definition of the envelope.",
  "type": "object",
  "required": ["id", "ts", "from", "to"],
  "additionalProperties": false,
  "properties": {
    "id": {
      "type": "string",
      "description": "Unique message id. A reply references it via in_reply_to; there is no separate request id."
    },
    "ts": {
      "type": "string",
      "format": "date-time",
      "description": "When the message was created."
    },
    "from": {
      "type": "string",
      "description": "Sender agent id."
    },
    "to": {
      "type": "string",
      "description": "Recipient: an agent id (directed), or `*` (everyone / broadcast)."
    },
    "in_reply_to": {
      "type": "string",
      "description": "The id of the request this message answers. Present only on a reply."
    },
    "notify_user": {
      "const": true,
      "description": "Present and true only when the sending agent intends the user to see this."
    },
    "operator_origin": {
      "const": true,
      "description": "Present and true only when the message originates from the operator."
    },
    "body": {
      "description": "The payload. Optional; any type. A standard request's body is a fixed identifier string (e.g. \"identity\", \"status\") that the recipient's sidecar answers itself."
    },
    "question_id": {
      "type": "string",
      "description": "Present only on a courier.py `ask` broadcast (sidebar-polish item 12). A reply references it via the existing in_reply_to field — answers add no new envelope field of their own."
    },
    "question": {
      "type": "string",
      "description": "The question text, present only alongside question_id."
    },
    "options": {
      "type": "array",
      "items": {"type": "string"},
      "description": "Numbered answer choices, present only alongside question_id; array index = display/option number."
    },
    "title": {
      "type": "string",
      "description": "Optional short title for a `courier.py ask` broadcast (sidebar-polish item 12g), shown prominently above the question in the popup. Present only alongside question_id."
    },
    "summary": {
      "type": "string",
      "description": "Optional short summary of what the decision is about, for a `courier.py ask` broadcast (item 12g). Present only alongside question_id."
    },
    "multi": {
      "const": true,
      "description": "Present and true only when a `courier.py ask --multi` broadcast (item 12g): the popup is a multi-select (digits toggle, Enter confirms) rather than the default instant-on-digit single-select."
    },
    "subject": {
      "type": "string",
      "description": "Fixed orchard wire-grammar subject (e.g. orchard:agent:status, orchard:agent:outcome:success|fail, orchard:agent:lifecycle:starting|started|stopping|stopped, orchard:agent:delegation:begin|end:<sub>, orchard:bus:subscribe|unsubscribe:<topic>, orchard:operator:message:todo|instructions|request|response|content, orchard:agent:message:request|response|content). Present only on an orchard-transport envelope (`from`/`to` using :session:/:topic: addressing)."
    },
    "repo": {
      "type": "string",
      "description": "The sender's project slug (<repo>.<project>), present only on an orchard-transport envelope."
    },
    "project": {
      "type": "string",
      "description": "The target project slug for a cross-project :session: send, present only when the send crosses projects."
    }
  }
}
