{"id": "8bb21ab1d668", "ts": "2026-07-26T14:04:03.469973+00:00",
 "from": ":session:1e6b83cc-f7b1-4010-a66a-6be5951d21aa", "to": ":session:1e6b83cc-f7b1-4010-a66a-6be5951d21aa",
 "subject": "orchard:agent:message:content", "repo": "kaukea.orchids", "project": "kaukea.orchids",
 "body": {"kind": "lifecycle", "state": "done", "feature_id": "sidebar-empty-rows"}}
